outputs/evaluations/nih_threshold_sweep_after_third_ft.json

{
  "metadata": {
    "manifest": "outputs/nih/nih_224_binary_manifest.csv",
    "checkpoint_dir": "outputs/runs_third_finetune",
    "thresholds": [
      0.5,
      0.6,
      0.65,
      0.7
    ],
    "requested_models": [
      "pneumonia_net",
      "resnet18",
      "mobilenet_v3_large",
      "efficientnet_b0",
      "densenet121"
    ],
    "completed_models": [
      "pneumonia_net",
      "resnet18",
      "mobilenet_v3_large",
      "efficientnet_b0",
      "densenet121"
    ],
    "num_samples": 61765,
    "device": "cpu"
  },
  "best_by_model": {
    "densenet121": {
      "model_name": "densenet121",
      "checkpoint": "outputs/runs_third_finetune/densenet121/best.pt",
      "tn": 13315,
      "fp": 47097,
      "fn": 108,
      "tp": 1245,
      "accuracy": 0.2357322107989962,
      "sensitivity": 0.9201773835920177,
      "specificity": 0.22040323114612992,
      "balanced_accuracy": 0.5702903073690738,
      "precision_normal": 0.9919541086195336,
      "precision_pneumonia": 0.02575400273054487,
      "f1_normal": 0.3606690593891786,
      "f1_pneumonia": 0.050105644431029286,
      "roc_auc": 0.6745215802952274,
      "pr_auc": 0.03897052923012324,
      "threshold": 0.7,
      "support_normal": 60412,
      "support_pneumonia": 1353,
      "loss": 8.823182661904118,
      "seconds_per_image": 0.08304899578037722
    },
    "efficientnet_b0": {
      "model_name": "efficientnet_b0",
      "checkpoint": "outputs/runs_third_finetune/efficientnet_b0/best.pt",
      "tn": 10122,
      "fp": 50290,
      "fn": 84,
      "tp": 1269,
      "accuracy": 0.1844248360722092,
      "sensitivity": 0.9379157427937915,
      "specificity": 0.16754949347811693,
      "balanced_accuracy": 0.5527326181359542,
      "precision_normal": 0.9917695473251029,
      "precision_pneumonia": 0.024612579762989972,
      "f1_normal": 0.2866691211872327,
      "f1_pneumonia": 0.04796643483519806,
      "roc_auc": 0.6422064120044089,
      "pr_auc": 0.03518735768842789,
      "threshold": 0.7,
      "support_normal": 60412,
      "support_pneumonia": 1353,
      "loss": 8.057518377078647,
      "seconds_per_image": 0.04957414470101051
    },
    "mobilenet_v3_large": {
      "model_name": "mobilenet_v3_large",
      "checkpoint": "outputs/runs_third_finetune/mobilenet_v3_large/best.pt",
      "tn": 17634,
      "fp": 42778,
      "fn": 154,
      "tp": 1199,
      "accuracy": 0.304913786124828,
      "sensitivity": 0.8861788617886179,
      "specificity": 0.29189564987088656,
      "balanced_accuracy": 0.5890372558297523,
      "precision_normal": 0.9913424780751068,
      "precision_pneumonia": 0.02726425176796962,
      "f1_normal": 0.450997442455243,
      "f1_pneumonia": 0.0529009485991617,
      "roc_auc": 0.6646271238554633,
      "pr_auc": 0.038989198455881724,
      "threshold": 0.7,
      "support_normal": 60412,
      "support_pneumonia": 1353,
      "loss": 7.266998019102063,
      "seconds_per_image": 0.03120363745310468
    },
    "pneumonia_net": {
      "model_name": "pneumonia_net",
      "checkpoint": "outputs/runs_third_finetune/pneumonia_net/best.pt",
      "tn": 13922,
      "fp": 46490,
      "fn": 139,
      "tp": 1214,
      "accuracy": 0.24505788067675868,
      "sensitivity": 0.8972653362897265,
      "specificity": 0.23045090379394823,
      "balanced_accuracy": 0.5638581200418373,
      "precision_normal": 0.9901145011023398,
      "precision_pneumonia": 0.02544859969813852,
      "f1_normal": 0.3738804667463376,
      "f1_pneumonia": 0.04949344639908678,
      "roc_auc": 0.6098292770035019,
      "pr_auc": 0.02908680504087058,
      "threshold": 0.7,
      "support_normal": 60412,
      "support_pneumonia": 1353,
      "loss": 5.700270768172305,
      "seconds_per_image": 0.00565597802085411
    },
    "resnet18": {
      "model_name": "resnet18",
      "checkpoint": "outputs/runs_third_finetune/resnet18/best.pt",
      "tn": 10486,
      "fp": 49926,
      "fn": 73,
      "tp": 1280,
      "accuracy": 0.1904962357322108,
      "sensitivity": 0.9460458240946046,
      "specificity": 0.17357478646626498,
      "balanced_accuracy": 0.5598103052804347,
      "precision_normal": 0.9930864665214509,
      "precision_pneumonia": 0.024997070655782525,
      "f1_normal": 0.2955009792732243,
      "f1_pneumonia": 0.04870716718354611,
      "roc_auc": 0.669203111533863,
      "pr_auc": 0.03828657035519274,
      "threshold": 0.7,
      "support_normal": 60412,
      "support_pneumonia": 1353,
      "loss": 9.038369679433618,
      "seconds_per_image": 0.019661214260374187
    }
  },
  "rows": [
    {
      "model_name": "densenet121",
      "checkpoint": "outputs/runs_third_finetune/densenet121/best.pt",
      "tn": 11128,
      "fp": 49284,
      "fn": 83,
      "tp": 1270,
      "accuracy": 0.2007285679592002,
      "sensitivity": 0.9386548410938654,
      "specificity": 0.18420181420909754,
      "balanced_accuracy": 0.5614283276514815,
      "precision_normal": 0.9925965569529926,
      "precision_pneumonia": 0.02512165209478973,
      "f1_normal": 0.3107381706993564,
      "f1_pneumonia": 0.0489336698325852,
      "roc_auc": 0.6745215802952274,
      "pr_auc": 0.03897052923012324,
      "threshold": 0.5,
      "support_normal": 60412,
      "support_pneumonia": 1353,
      "loss": 8.823182661904118,
      "seconds_per_image": 0.08304899578037722
    },
    {
      "model_name": "densenet121",
      "checkpoint": "outputs/runs_third_finetune/densenet121/best.pt",
      "tn": 12126,
      "fp": 48286,
      "fn": 93,
      "tp": 1260,
      "accuracy": 0.2167246822634178,
      "sensitivity": 0.9312638580931264,
      "specificity": 0.20072171091836058,
      "balanced_accuracy": 0.5659927845057435,
      "precision_normal": 0.9923889025288485,
      "precision_pneumonia": 0.025430912687199773,
      "f1_normal": 0.3339070094036981,
      "f1_pneumonia": 0.04950981355232912,
      "roc_auc": 0.6745215802952274,
      "pr_auc": 0.03897052923012324,
      "threshold": 0.6,
      "support_normal": 60412,
      "support_pneumonia": 1353,
      "loss": 8.823182661904118,
      "seconds_per_image": 0.08304899578037722
    },
    {
      "model_name": "densenet121",
      "checkpoint": "outputs/runs_third_finetune/densenet121/best.pt",
      "tn": 12711,
      "fp": 47701,
      "fn": 99,
      "tp": 1254,
      "accuracy": 0.2260989233384603,
      "sensitivity": 0.926829268292683,
      "specificity": 0.21040521750645566,
      "balanced_accuracy": 0.5686172428995693,
      "precision_normal": 0.992271662763466,
      "precision_pneumonia": 0.02561536104585844,
      "f1_normal": 0.3471907350249924,
      "f1_pneumonia": 0.049852906098433646,
      "roc_auc": 0.6745215802952274,
      "pr_auc": 0.03897052923012324,
      "threshold": 0.65,
      "support_normal": 60412,
      "support_pneumonia": 1353,
      "loss": 8.823182661904118,
      "seconds_per_image": 0.08304899578037722
    },
    {
      "model_name": "densenet121",
      "checkpoint": "outputs/runs_third_finetune/densenet121/best.pt",
      "tn": 13315,
      "fp": 47097,
      "fn": 108,
      "tp": 1245,
      "accuracy": 0.2357322107989962,
      "sensitivity": 0.9201773835920177,
      "specificity": 0.22040323114612992,
      "balanced_accuracy": 0.5702903073690738,
      "precision_normal": 0.9919541086195336,
      "precision_pneumonia": 0.02575400273054487,
      "f1_normal": 0.3606690593891786,
      "f1_pneumonia": 0.050105644431029286,
      "roc_auc": 0.6745215802952274,
      "pr_auc": 0.03897052923012324,
      "threshold": 0.7,
      "support_normal": 60412,
      "support_pneumonia": 1353,
      "loss": 8.823182661904118,
      "seconds_per_image": 0.08304899578037722
    },
    {
      "model_name": "efficientnet_b0",
      "checkpoint": "outputs/runs_third_finetune/efficientnet_b0/best.pt",
      "tn": 7681,
      "fp": 52731,
      "fn": 55,
      "tp": 1298,
      "accuracy": 0.14537359345907877,
      "sensitivity": 0.959349593495935,
      "specificity": 0.12714361385155268,
      "balanced_accuracy": 0.5432466036737438,
      "precision_normal": 0.9928903826266805,
      "precision_pneumonia": 0.024024135186659017,
      "f1_normal": 0.22542114221987442,
      "f1_pneumonia": 0.04687443573724315,
      "roc_auc": 0.6422064120044089,
      "pr_auc": 0.03518735768842789,
      "threshold": 0.5,
      "support_normal": 60412,
      "support_pneumonia": 1353,
      "loss": 8.057518377078647,
      "seconds_per_image": 0.04957414470101051
    },
    {
      "model_name": "efficientnet_b0",
      "checkpoint": "outputs/runs_third_finetune/efficientnet_b0/best.pt",
      "tn": 8870,
      "fp": 51542,
      "fn": 66,
      "tp": 1287,
      "accuracy": 0.16444588359103052,
      "sensitivity": 0.9512195121951219,
      "specificity": 0.146825134079322,
      "balanced_accuracy": 0.549022323137222,
      "precision_normal": 0.9926141450313339,
      "precision_pneumonia": 0.024361619565011643,
      "f1_normal": 0.25581127069273807,
      "f1_pneumonia": 0.047506551991436274,
      "roc_auc": 0.6422064120044089,
      "pr_auc": 0.03518735768842789,
      "threshold": 0.6,
      "support_normal": 60412,
      "support_pneumonia": 1353,
      "loss": 8.057518377078647,
      "seconds_per_image": 0.04957414470101051
    },
    {
      "model_name": "efficientnet_b0",
      "checkpoint": "outputs/runs_third_finetune/efficientnet_b0/best.pt",
      "tn": 9460,
      "fp": 50952,
      "fn": 75,
      "tp": 1278,
      "accuracy": 0.1738525054642597,
      "sensitivity": 0.9445676274944568,
      "specificity": 0.15659140568099053,
      "balanced_accuracy": 0.5505795165877236,
      "precision_normal": 0.9921342422653382,
      "precision_pneumonia": 0.02446869615163699,
      "f1_normal": 0.2704905142465009,
      "f1_pneumonia": 0.04770169643357035,
      "roc_auc": 0.6422064120044089,
      "pr_auc": 0.03518735768842789,
      "threshold": 0.65,
      "support_normal": 60412,
      "support_pneumonia": 1353,
      "loss": 8.057518377078647,
      "seconds_per_image": 0.04957414470101051
    },
    {
      "model_name": "efficientnet_b0",
      "checkpoint": "outputs/runs_third_finetune/efficientnet_b0/best.pt",
      "tn": 10122,
      "fp": 50290,
      "fn": 84,
      "tp": 1269,
      "accuracy": 0.1844248360722092,
      "sensitivity": 0.9379157427937915,
      "specificity": 0.16754949347811693,
      "balanced_accuracy": 0.5527326181359542,
      "precision_normal": 0.9917695473251029,
      "precision_pneumonia": 0.024612579762989972,
      "f1_normal": 0.2866691211872327,
      "f1_pneumonia": 0.04796643483519806,
      "roc_auc": 0.6422064120044089,
      "pr_auc": 0.03518735768842789,
      "threshold": 0.7,
      "support_normal": 60412,
      "support_pneumonia": 1353,
      "loss": 8.057518377078647,
      "seconds_per_image": 0.04957414470101051
    },
    {
      "model_name": "mobilenet_v3_large",
      "checkpoint": "outputs/runs_third_finetune/mobilenet_v3_large/best.pt",
      "tn": 13606,
      "fp": 46806,
      "fn": 107,
      "tp": 1246,
      "accuracy": 0.2404598073342508,
      "sensitivity": 0.9209164818920916,
      "specificity": 0.22522015493610542,
      "balanced_accuracy": 0.5730683184140986,
      "precision_normal": 0.9921971851527748,
      "precision_pneumonia": 0.025930242237575958,
      "f1_normal": 0.36710961214165266,
      "f1_pneumonia": 0.05044023884222244,
      "roc_auc": 0.6646271238554633,
      "pr_auc": 0.038989198455881724,
      "threshold": 0.5,
      "support_normal": 60412,
      "support_pneumonia": 1353,
      "loss": 7.266998019102063,
      "seconds_per_image": 0.03120363745310468
    },
    {
      "model_name": "mobilenet_v3_large",
      "checkpoint": "outputs/runs_third_finetune/mobilenet_v3_large/best.pt",
      "tn": 15622,
      "fp": 44790,
      "fn": 131,
      "tp": 1222,
      "accuracy": 0.27271108232817937,
      "sensitivity": 0.9031781226903178,
      "specificity": 0.2585910084089254,
      "balanced_accuracy": 0.5808845655496216,
      "precision_normal": 0.9916841236589856,
      "precision_pneumonia": 0.026558289141962965,
      "f1_normal": 0.4102146655287862,
      "f1_pneumonia": 0.051599282170378964,
      "roc_auc": 0.6646271238554633,
      "pr_auc": 0.038989198455881724,
      "threshold": 0.6,
      "support_normal": 60412,
      "support_pneumonia": 1353,
      "loss": 7.266998019102063,
      "seconds_per_image": 0.03120363745310468
    },
    {
      "model_name": "mobilenet_v3_large",
      "checkpoint": "outputs/runs_third_finetune/mobilenet_v3_large/best.pt",
      "tn": 16609,
      "fp": 43803,
      "fn": 143,
      "tp": 1210,
      "accuracy": 0.2884967214441836,
      "sensitivity": 0.8943089430894309,
      "specificity": 0.2749288220883268,
      "balanced_accuracy": 0.5846188825888788,
      "precision_normal": 0.99146370582617,
      "precision_pneumonia": 0.026881123231066582,
      "f1_normal": 0.430485718728941,
      "f1_pneumonia": 0.052193417590475785,
      "roc_auc": 0.6646271238554633,
      "pr_auc": 0.038989198455881724,
      "threshold": 0.65,
      "support_normal": 60412,
      "support_pneumonia": 1353,
      "loss": 7.266998019102063,
      "seconds_per_image": 0.03120363745310468
    },
    {
      "model_name": "mobilenet_v3_large",
      "checkpoint": "outputs/runs_third_finetune/mobilenet_v3_large/best.pt",
      "tn": 17634,
      "fp": 42778,
      "fn": 154,
      "tp": 1199,
      "accuracy": 0.304913786124828,
      "sensitivity": 0.8861788617886179,
      "specificity": 0.29189564987088656,
      "balanced_accuracy": 0.5890372558297523,
      "precision_normal": 0.9913424780751068,
      "precision_pneumonia": 0.02726425176796962,
      "f1_normal": 0.450997442455243,
      "f1_pneumonia": 0.0529009485991617,
      "roc_auc": 0.6646271238554633,
      "pr_auc": 0.038989198455881724,
      "threshold": 0.7,
      "support_normal": 60412,
      "support_pneumonia": 1353,
      "loss": 7.266998019102063,
      "seconds_per_image": 0.03120363745310468
    },
    {
      "model_name": "pneumonia_net",
      "checkpoint": "outputs/runs_third_finetune/pneumonia_net/best.pt",
      "tn": 10854,
      "fp": 49558,
      "fn": 106,
      "tp": 1247,
      "accuracy": 0.19592001942847892,
      "sensitivity": 0.9216555801921655,
      "specificity": 0.1796662914652718,
      "balanced_accuracy": 0.5506609358287187,
      "precision_normal": 0.9903284671532847,
      "precision_pneumonia": 0.024544828264934555,
      "f1_normal": 0.30415288908815785,
      "f1_pneumonia": 0.04781625062310672,
      "roc_auc": 0.6098292770035019,
      "pr_auc": 0.02908680504087058,
      "threshold": 0.5,
      "support_normal": 60412,
      "support_pneumonia": 1353,
      "loss": 5.700270768172305,
      "seconds_per_image": 0.00565597802085411
    },
    {
      "model_name": "pneumonia_net",
      "checkpoint": "outputs/runs_third_finetune/pneumonia_net/best.pt",
      "tn": 12309,
      "fp": 48103,
      "fn": 125,
      "tp": 1228,
      "accuracy": 0.21916943252651178,
      "sensitivity": 0.9076127124907613,
      "specificity": 0.2037509104151493,
      "balanced_accuracy": 0.5556818114529553,
      "precision_normal": 0.9899469197362072,
      "precision_pneumonia": 0.024893069266789646,
      "f1_normal": 0.3379458034758257,
      "f1_pneumonia": 0.048457106779259726,
      "roc_auc": 0.6098292770035019,
      "pr_auc": 0.02908680504087058,
      "threshold": 0.6,
      "support_normal": 60412,
      "support_pneumonia": 1353,
      "loss": 5.700270768172305,
      "seconds_per_image": 0.00565597802085411
    },
    {
      "model_name": "pneumonia_net",
      "checkpoint": "outputs/runs_third_finetune/pneumonia_net/best.pt",
      "tn": 13052,
      "fp": 47360,
      "fn": 133,
      "tp": 1220,
      "accuracy": 0.23106937586011495,
      "sensitivity": 0.90169992609017,
      "specificity": 0.2160497914321658,
      "balanced_accuracy": 0.5588748587611679,
      "precision_normal": 0.9899127796738718,
      "precision_pneumonia": 0.025113215314944422,
      "f1_normal": 0.3546883704498825,
      "f1_pneumonia": 0.048865479742855426,
      "roc_auc": 0.6098292770035019,
      "pr_auc": 0.02908680504087058,
      "threshold": 0.65,
      "support_normal": 60412,
      "support_pneumonia": 1353,
      "loss": 5.700270768172305,
      "seconds_per_image": 0.00565597802085411
    },
    {
      "model_name": "pneumonia_net",
      "checkpoint": "outputs/runs_third_finetune/pneumonia_net/best.pt",
      "tn": 13922,
      "fp": 46490,
      "fn": 139,
      "tp": 1214,
      "accuracy": 0.24505788067675868,
      "sensitivity": 0.8972653362897265,
      "specificity": 0.23045090379394823,
      "balanced_accuracy": 0.5638581200418373,
      "precision_normal": 0.9901145011023398,
      "precision_pneumonia": 0.02544859969813852,
      "f1_normal": 0.3738804667463376,
      "f1_pneumonia": 0.04949344639908678,
      "roc_auc": 0.6098292770035019,
      "pr_auc": 0.02908680504087058,
      "threshold": 0.7,
      "support_normal": 60412,
      "support_pneumonia": 1353,
      "loss": 5.700270768172305,
      "seconds_per_image": 0.00565597802085411
    },
    {
      "model_name": "resnet18",
      "checkpoint": "outputs/runs_third_finetune/resnet18/best.pt",
      "tn": 7765,
      "fp": 52647,
      "fn": 60,
      "tp": 1293,
      "accuracy": 0.14665263498745243,
      "sensitivity": 0.9556541019955654,
      "specificity": 0.12853406607958684,
      "balanced_accuracy": 0.5420940840375761,
      "precision_normal": 0.9923322683706071,
      "precision_pneumonia": 0.023971078976640713,
      "f1_normal": 0.22758913785776044,
      "f1_pneumonia": 0.046769030437849274,
      "roc_auc": 0.669203111533863,
      "pr_auc": 0.03828657035519274,
      "threshold": 0.5,
      "support_normal": 60412,
      "support_pneumonia": 1353,
      "loss": 9.038369679433618,
      "seconds_per_image": 0.019661214260374187
    },
    {
      "model_name": "resnet18",
      "checkpoint": "outputs/runs_third_finetune/resnet18/best.pt",
      "tn": 8996,
      "fp": 51416,
      "fn": 67,
      "tp": 1286,
      "accuracy": 0.16646968347769772,
      "sensitivity": 0.950480413895048,
      "specificity": 0.14891081242137325,
      "balanced_accuracy": 0.5496956131582106,
      "precision_normal": 0.9926073044245834,
      "precision_pneumonia": 0.024401350992372207,
      "f1_normal": 0.2589708528247571,
      "f1_pneumonia": 0.04758116732957174,
      "roc_auc": 0.669203111533863,
      "pr_auc": 0.03828657035519274,
      "threshold": 0.6,
      "support_normal": 60412,
      "support_pneumonia": 1353,
      "loss": 9.038369679433618,
      "seconds_per_image": 0.019661214260374187
    },
    {
      "model_name": "resnet18",
      "checkpoint": "outputs/runs_third_finetune/resnet18/best.pt",
      "tn": 9707,
      "fp": 50705,
      "fn": 68,
      "tp": 1285,
      "accuracy": 0.17796486683396745,
      "sensitivity": 0.9497413155949741,
      "specificity": 0.16067999735151955,
      "balanced_accuracy": 0.5552106564732469,
      "precision_normal": 0.9930434782608696,
      "precision_pneumonia": 0.02471629159453741,
      "f1_normal": 0.2766039295026145,
      "f1_pneumonia": 0.0481787675983728,
      "roc_auc": 0.669203111533863,
      "pr_auc": 0.03828657035519274,
      "threshold": 0.65,
      "support_normal": 60412,
      "support_pneumonia": 1353,
      "loss": 9.038369679433618,
      "seconds_per_image": 0.019661214260374187
    },
    {
      "model_name": "resnet18",
      "checkpoint": "outputs/runs_third_finetune/resnet18/best.pt",
      "tn": 10486,
      "fp": 49926,
      "fn": 73,
      "tp": 1280,
      "accuracy": 0.1904962357322108,
      "sensitivity": 0.9460458240946046,
      "specificity": 0.17357478646626498,
      "balanced_accuracy": 0.5598103052804347,
      "precision_normal": 0.9930864665214509,
      "precision_pneumonia": 0.024997070655782525,
      "f1_normal": 0.2955009792732243,
      "f1_pneumonia": 0.04870716718354611,
      "roc_auc": 0.669203111533863,
      "pr_auc": 0.03828657035519274,
      "threshold": 0.7,
      "support_normal": 60412,
      "support_pneumonia": 1353,
      "loss": 9.038369679433618,
      "seconds_per_image": 0.019661214260374187
    }
  ]
}

docs/thesis/third-dataset-results.md

## Test NIH post fine-tuning

`DenseNet121` post fine-tuning su NIH ha prodotto: balanced accuracy `0.5614`, sensitivity `0.9387`, specificity `0.1842`, ROC-AUC `0.6745`. Non viene inserita nella tabella comparativa principale perche' manca la valutazione baseline NIH completa, interrotta per tempi eccessivi.

## Analisi esplorativa delle soglie su NIH

`MobileNetV3-Large` ottiene la balanced accuracy migliore dell'analisi
(`0.5890` a soglia `0.70`) e la specificity piu' alta (`0.2919`). Tuttavia, la
specificity resta bassa per tutti i modelli e il domain shift non viene risolto
dal solo cambiamento di soglia.